retraction_doi,retraction_title,retraction_year,retraction_abstract,original_doi,original_title,original_year,container_title,publisher,subject,open_access_original,open_access_notice,method_signal,screen_methodological,screen_specific,screen_text_detectable,screen_include,screen_summary,screen_rationale
10.4103/0975-7406.155959,Combination restoration in full mouth rehabilitation,2015,<jats:p>Successful restoration of the dentition requires plenty of contemporary and conventional treatment techniques and planning and attachment retained partial dentures are one such kind of treatment modality in prosthodontics. Satisfactory restoration in a patient with a partially edentulous situation can be challenging especially when unilateral or bilateral posterior segment of teeth is missing. One such treatment modality is attachment-retained cast partial dentures. The purpose of this article is to provide an overview of a case with maxillary complete denture and opposing cast partial denture with precision attachment.</jats:p>,10.4103/0975-7406.191958,Retraction: Combination restoration in full mouth rehabilitation,2016,Journal of Pharmacy and Bioallied Sciences,Ovid Technologies (Wolters Kluwer Health),,False,False,False,False,False,False,False,No specific error is documented; the retraction notice only provides the original abstract without any reason for retraction.,"The retraction notice does not describe any methodological error or specific reason for retraction; it merely reprints the original abstract. Therefore, none of the three inclusion criteria are met, and the paper should be excluded."
10.4103/1658-354x.174919,"Controlled hypotension in day care functional endoscopic sinus surgery: A comparison between esmolol and dexmedetomidine: A prospective, double-blind, and randomized study",2016,"<jats:sec>                     <jats:title>Background:</jats:title>                     <jats:p>Functional endoscopic sinus surgery (FESS) is the cornerstone of therapeutic management for nasal pathologies. This study is to compare the ability of preoperative and intraoperative esmolol versus dexmedetomidine for producing induced hypotension during FESS in adults in a day care setting.</jats:p>                   </jats:sec>                   <jats:sec>                     <jats:title>Materials and Methods:</jats:title>                     <jats:p>                       Sixty patients (20-45 years) posted for FESS under general anesthesia were randomly divided into Group E (                       <jats:italic toggle=""yes"">n</jats:italic>                       = 30) receiving esmolol, loading dose 1 mg/kg over 1 min followed by 0.5 mg/kg/h infusion during maintenance and Group D (                       <jats:italic toggle=""yes"">n</jats:italic>                       = 30) receiving dexmedetomidine 1 μg/kg over 15 min before induction of anesthesia followed by 0.5 μg/Kg/h infusion during maintenance, respectively. Nasal bleeding and Surgeon's satisfaction score; amount and number of patients receiving fentanyl and nitroglycerine for analgesia and deliberate hypotension, Postanesthesia Care Unit (PACU) and hospital stay; hemodynamic parameters and side effects were recorded for each patient.                     </jats:p>                   </jats:sec>                   <jats:sec>  ",10.4103/1658-354x.285417,Retraction,2020,Saudi Journal of Anaesthesia,Ovid Technologies (Wolters Kluwer Health),,False,False,True,False,False,False,False,The retraction notice does not describe any specific error; it only provides the original abstract without stating a reason for retraction.,"The notice merely reproduces the original paper's abstract and does not mention any methodological error, misconduct, or specific reason for retraction. Therefore, none of the three inclusion criteria are met."
10.3390/agronomy15020266,"RETRACTED: Al-Deeb et al. Individual and Interactive Ecophysiological Effect of Temperature, Watering Regime and Abscisic Acid on the Growth and Development of Tomato Seedlings. Agronomy 2023, 13, 930",2025,"<jats:p>The journal retracts the article titled “Individual and Interactive Ecophysiological Effect of Temperature, Watering Regime and Abscisic Acid on the Growth and Development of Tomato Seedlings” [...]</jats:p>",10.3390/agronomy13030930,"RETRACTED: Individual and Interactive Ecophysiological Effect of Temperature, Watering Regime and Abscisic Acid on the Growth and Development of Tomato Seedlings",2023,Agronomy,MDPI AG,,True,True,True,False,False,False,False,The retraction notice does not describe any specific error; it only states the article is retracted without providing details.,"The retraction notice abstract is incomplete and does not specify any methodological error, misconduct, or other reason for retraction. Therefore, none of the three inclusion criteria are met, and the paper should not be included."
10.3390/electronics13173493,"RETRACTED: Huamanchahua et al. Kinematic of the Position and Orientation Synchronization of the Posture of a n DoF Upper-Limb Exoskeleton with a Virtual Object in an Immersive Virtual Reality Environment. Electronics 2021, 10, 1069",2024,"<jats:p>The journal is retracting the article, “Kinematic of the Position and Orientation Synchronization of the Posture of a n DoF Upper-Limb Exoskeleton with a Virtual Object in an Immersive Virtual Reality Environment” [...]</jats:p>",10.3390/electronics10091069,RETRACTED: Kinematic of the Position and Orientation Synchronization of the Posture of a n DoF Upper-Limb Exoskeleton with a Virtual Object in an Immersive Virtual Reality Environment,2021,Electronics,MDPI AG,,True,True,False,False,False,False,False,The retraction notice does not describe any specific error; it only states the article is retracted.,"The retraction notice abstract provides no details about the reason for retraction, so it cannot be determined whether a methodological error occurred, nor is any specific error documented. Therefore, the paper does not meet any of the three inclusion criteria."
10.3390/en15207645,"RETRACTED: Abdallah et al. A Critical Review on Recycling Composite Waste Using Pyrolysis for Sustainable Development. Energies 2021, 14, 5748",2022,"<jats:p>The journal retracts the article “A Critical Review on Recycling Composite Waste Using Pyrolysis for Sustainable Development” Energies 2021, 14(18), 5748 [...]</jats:p>",10.3390/en14185748,RETRACTED: A Critical Review on Recycling Composite Waste Using Pyrolysis for Sustainable Development,2021,Energies,MDPI AG,,True,True,False,False,False,False,False,No specific methodological error is described; the retraction notice only states the article was retracted without providing details.,"The retraction notice abstract does not describe any methodological error, only that the article was retracted. Without a specific error documented, the paper does not meet the inclusion criteria."
10.3390/fishes10100520,"RETRACTED: Li et al. Influences of Cr(VI) on SOD Activity, MDA, and MT Content in the Hepatopancreas and Gill of Portunus trituberculatus. Fishes 2024, 9, 407",2025,"<jats:p>The journal retracts the article titled “Influences of Cr(VI) on SOD Activity, MDA, and MT Content in the Hepatopancreas and Gill of Portunus trituberculatus” [...]</jats:p>",10.3390/fishes9100407,"RETRACTED: Influences of Cr(VI) on SOD Activity, MDA, and MT Content in the Hepatopancreas and Gill of Portunus trituberculatus",2024,Fishes,MDPI AG,,True,True,False,False,False,False,False,No specific methodological error is described; the retraction notice only references a generic integrity concern.,"The retraction notice abstract provided does not describe any specific methodological error such as a statistical or design flaw; it merely states the article was retracted without detailing the reason. Therefore, none of the three criteria are met, and the paper should not be included."
10.3390/ijms262110605,"RETRACTED: Bartlett et al. Uremic Toxins Activates Na/K-ATPase Oxidant Amplification Loop Causing Phenotypic Changes in Adipocytes in In Vitro Models. Int. J. Mol. Sci. 2018, 19, 2685",2025,<jats:p>The journal retracts the article titled “Uremic Toxins Activates Na/K-ATPase Oxidant Amplification Loop Causing Phenotypic Changes in Adipocytes in In Vitro Models” [...]</jats:p>,10.3390/ijms19092685,RETRACTED: Uremic Toxins Activates Na/K-ATPase Oxidant Amplification Loop Causing Phenotypic Changes in Adipocytes in In Vitro Models,2018,International Journal of Molecular Sciences,MDPI AG,,True,True,False,False,False,False,False,"No specific methodological error is described; the retraction notice is not provided in full, but the abstract only indicates retraction without detailing any error.","The retraction notice abstract does not describe any specific methodological error, only stating that the article is retracted. Without a documented error, criteria A and B are not met, so the paper cannot be included."
10.3390/molecules191016810,"RETRACTED: Beltaïef et al. An Expeditious Synthesis of [1,2]Isoxazolidin-5-ones and [1,2]Oxazin-6-ones from Functional Allyl Bromide Derivatives. Molecules 2010, 15, 4094-4101",2014,"<jats:p>We have been made aware that the figures, tables, compounds and experimental data reported in the title paper [1] are duplicated in another publication by the same authors [2]. [...]</jats:p>",10.3390/molecules15064094,"RETRACTED: An Expeditious Synthesis of [1,2]Isoxazolidin-5-ones and [1,2]Oxazin-6-ones from Functional Allyl Bromide Derivatives",2010,Molecules,MDPI AG,,True,True,False,False,False,False,False,"The retraction notice states that figures, tables, compounds, and experimental data are duplicated from another publication by the same authors.","The retraction is based on duplication of content, not a methodological error. No specific methodological mistake is described, and the error is not inferable from the manuscript's text alone."
10.3390/sym16101329,"RETRACTED: ELrokh et al. On Cubic Roots Cordial Labeling for Some Graphs. Symmetry 2023, 15, 990",2024,<jats:p>The journal Symmetry retracts the article titled “On Cubic Roots Cordial Labeling for Some Graphs” [...]</jats:p>,10.3390/sym15050990,RETRACTED: On Cubic Roots Cordial Labeling for Some Graphs,2023,Symmetry,MDPI AG,,True,True,False,False,False,False,False,The retraction notice does not describe any specific methodological error.,"The provided retraction notice abstract only states that the journal retracts the article, without mentioning any reason or specific error. Therefore, it fails all three criteria, and the paper should not be included."
